Título de la publicación,Autor de la publicación,URL,Puntaje,Comentario,Autor del comentario
Do you think there will be a Switch Lite 2?,Right-Fortune-8644,https://www.reddit.com/r/NintendoSwitch2/comments/1k9jxpq/do_you_think_there_will_be_a_switch_lite_2/,6,"Switch lite at a lower price is a nice budget friendly option for people wanting to enter into the world of Nintendo or to get a second one for their kid, it makes a lot of sense to make one for the 2",DOndus
Help me understand the upgrade system. please?,WorkingCautious1270,https://www.reddit.com/r/NintendoSwitch2/comments/1k9ioww/help_me_understand_the_upgrade_system_please/,0,$10 is the upgrade price if you already have a physical or digital Switch 1 copy already.,N64Andysaurus92
Help me understand the upgrade system. please?,WorkingCautious1270,https://www.reddit.com/r/NintendoSwitch2/comments/1k9ioww/help_me_understand_the_upgrade_system_please/,0,"I'm guessing that they're confusing the physical ""Switch 2 Edition"" copy of the game, which is the full price of the game plus the upgrade because it includes all of that, with the price of the digital ""Switch 2 Edition"" upgrade by itself.",montegarde
How would you rank these upcoming switch 2 games by anticipation?,Godofhammrs,https://www.reddit.com/gallery/1k9i17k,100,"Metroid Prime 4 is possibly my most anticipated extremely closely followed by Mario Kart World. DK and Age of Imprisonment are about equal following closely behind Mario Kart World. All 4 are day one purchases for me. Pokémon Legends Z-A I will get at some point but not all that hyped for it. Drag X Drive is one that I’m reserving judgement for. It looks intriguing, kind of has a Rocket League vibe, but I’m waiting to see if the game has any real content to it as well as waiting to see what price it is launching at. If it’s as bare bones as it looks and launches for more than $20 it’s a hard no for me. If it actually has some decent single player content, different courts, unlockable skins, various selectable modes then it might be worth it",Hefty_Storage_2094
How would you rank these upcoming switch 2 games by anticipation?,Godofhammrs,https://www.reddit.com/gallery/1k9i17k,100,"Of these six? 

Top one is Mario Kart World.  I'm really excited to try it out, and since it comes out day 1 I'm gonna be playing it before any of these other titles, so I'm anticipating it the most.  
  
Number two is probably Donkey Kong Bananza.  It's also coming soon and it looks super fun.  
  
Number three is Pokémon Legends Z-A.  I hope it's going to be at least about as good as the first Legends game, because if it is then I will love it.  
  
Number 4 is Metroid Prime 4.  I just finished playing through Metroid Prime 2 with my fiancé this weekend.  We've been going through the series to get ready for it.  
  
Number 5 is Hyrule Warriors:  Age of Imprisonment.  Despite me absolutely loving the first two Hyrule Warriors games, Tears of the Kingdom really turned me off.  I don't like how it took basically nothing from Age of Calamity, and I just didn't have as much fun with it.  So a spin-off featuring characters I don't really care about in a story I don't really care about doesn't entice me much.  I don't need to get it at launch.  
  
Number 6 is Drag x Drive.  The gameplay looks like it could be fun, but the game has no characters and I don't see it having a lot of longevity with what I've seen.  Whatever price it comes out for will probably be too much.",MasterPeteDiddy
All Switch 2 Games Storage and cost for Fun,Howerev,https://www.reddit.com/gallery/1k9h6cl,10,"Yakuza 0 and raidou for 50 usd? Ouch. Yeah I’m gonna wait for a sale. That street fighter price is a steal for both versions though, I’m quite pleased with those",BlueIndividual76
Pack in charging grip?,The_F5_Lurker,https://www.reddit.com/r/NintendoSwitch2/comments/1k9gzt9/pack_in_charging_grip/,0,I'd rather no grip and knock a few bucks off the price.,Dr_Neo_Cortex_
Do we think Walmart can stick to their word?,FinerSugarSwine,https://www.reddit.com/r/NintendoSwitch2/comments/1k9gwxi/do_we_think_walmart_can_stick_to_their_word/,8,"My Walmart order has the ""bag"" icon, which from what I've read elsewhere means a local driver will be delivering it.  As others have said, I suspect that they will be heavily promoting for anyone and everyone to ""clock in"" to deliver that day, as it appears their delivery service works on a similar model to Doordash and similar services.  My order says that the price includes ""all fees and driver tip"", but it didn't give me an option to add an additional tip.",CrazyNateS
How much funds are you allocating for Switch 2,brandont04,https://i.redd.it/i2x0k5exigxe1.jpeg,33,Will have to see what prices look like next year when I get it …,rj_musics
How much funds are you allocating for Switch 2,brandont04,https://i.redd.it/i2x0k5exigxe1.jpeg,33,$550 (after taxes price) in credit card points for the bundle.,TehLoneWanderer101
How much funds are you allocating for Switch 2,brandont04,https://i.redd.it/i2x0k5exigxe1.jpeg,33,"Nah I’m just messing with you to make it seem like I’m scalping. Truth is, I pre-ordered 3 because I’ve been burned in the past when I pre-ordered a PS5 from Walmart when they canceled my order. If I happen to have all 3 of my pre-orders by the time launch day comes around, I’m selling the extras to a buddy of mine and my dentist for retail price + tax. I’m not looking to make any money off of these but I’m also not going to just give them away.",SonicRicky
Everyone complaining about the Welcome Tour price.,JonnyBTokyo,https://i.redd.it/jovv8e91hgxe1.jpeg,0,Why did Sony increase the price then? This isn't launch. Mate are you another Sony fanboy.,JonnyBTokyo
Why i love the Switch (2) UI,sonicfonico,https://www.reddit.com/gallery/1k9gkmn,523,"People will really pay more, get WAY less, say they like it and pretend like they aren't a problem when we get a nothing burger of a UI on an overpriced system with overpriced games!

Where are the free lobotomies I need one! 😍",Rhoodoniite
Why i love the Switch (2) UI,sonicfonico,https://www.reddit.com/gallery/1k9gkmn,523,"but that's the problem, we should be complaining. when everyone complained about the price it got their attention right ? complaining about this can also get their attention. there is no reason we can't get a better UI because we had better with previous consoles and we know it can work because modded switches can manage themes.",CulturalTrifle5247
Why i love the Switch (2) UI,sonicfonico,https://www.reddit.com/gallery/1k9gkmn,523,"Yeah, complaining about the price did get their attention, then they essentially said “buy it or don’t, we don’t care, others will.”, so go ahead and scream your head off about start up music, doesn’t mean they’re going to do anything to appease you",My_Name_Is_Row
Why i love the Switch (2) UI,sonicfonico,https://www.reddit.com/gallery/1k9gkmn,523,"i mean i'm not the only customer demanding nintendo to do better with their consoles but go off and btw, if nintendo really didn't care about what their customers think they wouldn't have responded about the price complaints and they wouldn't have tried to keep the cost of the device and it's accessories down (post tariffs).think about that for a moment.",CulturalTrifle5247
Why i love the Switch (2) UI,sonicfonico,https://www.reddit.com/gallery/1k9gkmn,523,nintendo hadn't responded to it because we kept buying their consoles. notice they responded when we said we aren't buying it for the price ? we got their attention. people still don't want to buy it because of it's price so if we also complain about not having a good UI (which it is capable of having) for that high price tag then we can make a difference. protesting works.,CulturalTrifle5247
Why i love the Switch (2) UI,sonicfonico,https://www.reddit.com/gallery/1k9gkmn,523,"I’m confused, are you now defending Nintendo because I criticized them? Just because they didn’t raise the prices of everything, doesn’t mean they care necessarily what the customers want, they just care about if they can sell the console, so yeah, I guess they care about the customers, they care that more customers would now not preorder it because they made it too expensive, that’s just about the only thing they care about, and honestly, that doesn’t really matter to me in the slightest, they’re one of if not the only major gaming company that isn’t owned by a hundred billion+ brand, they can’t  really afford to sell everything at a loss just because some people on the internet want them to, it’s just not good business",My_Name_Is_Row
Why i love the Switch (2) UI,sonicfonico,https://www.reddit.com/gallery/1k9gkmn,523,"lol i'm not defending nintendo. i'm simply pointing out that nintendo cares enough to try and keep the price as close to retail as possible even swallowing some of the extra costs that the tariffs will bring in order for people to buy the console. that aside, i personally don't think the switch is crazy expensive, my whole argument is that the UI is very basic and if you're selling a console for a price that many consumers are complaining about, you should make fresh changes (even minor details) that would make more people actually think the console is actually worth the price especially when people have been complaining about lack of creativity from the first switch. it's an easy opportunity to increase sales for them.",CulturalTrifle5247
Why i love the Switch (2) UI,sonicfonico,https://www.reddit.com/gallery/1k9gkmn,523,"No BUDDY i won’t on launch day because i’m a broke 13 year old, i wouldn’t rather it i’m just dealing with the situation, i just don’t think it’s happening right now but maybe 10 years down the line we’ll get menus especially if there’s like a new president or something. The community just doesn’t have much of a say in this particularly, also does themes and menus make Nintendo money? No they do not, do games make Nintendo money? Yes, so of course they responded about the price thing. That’s all Nintendo cares about, and plus the response was half assed anyway",Iamverydumbazz
The Switch 2 dilema,Ok-Pain8612,https://www.reddit.com/gallery/1k9gj0q,0,Price good. System good. Monkey game comming in july. Why the hell would not i buy this?,Bananabungalo
The Switch 2 dilema,Ok-Pain8612,https://www.reddit.com/gallery/1k9gj0q,0,Or maybe I just wasn't that upset about the price?,djwillis1121
The Switch 2 dilema,Ok-Pain8612,https://www.reddit.com/gallery/1k9gj0q,0,"Almost all the complaining was about the game price. All the people I saw said the console price is expected for the hardware. I don't like the $80 games, but that's exactly why I got the bundle so I don't pay $80 for Mario Kart",aaronxsubaru
Stock levels after launch,bbkboybetterknow84,https://www.reddit.com/r/NintendoSwitch2/comments/1k9fuxq/stock_levels_after_launch/,10,"I think there will be stock, but I also think it's possible tariffs change multiple times between now and then. Thats actually the entire reason I went ahead and bought a switch 2 - I know this version didn't see a price increase, but no idea what the future will hold for prices.",Eljako98
Stock levels after launch,bbkboybetterknow84,https://www.reddit.com/r/NintendoSwitch2/comments/1k9fuxq/stock_levels_after_launch/,10,"You’re right. No console has ever sold out pre orders due to scalpers. 

Big brain here. 

Let’s go check eBay, I bet there’s not a single one for sale for an enormous price on there.",Shawty-Got-Low
"I was ""only"" able to get a Mario kart bundle, but still want the physical. Do you think anyone, or would you want to buy the code for 40$?",Jojeff13,https://www.reddit.com/r/NintendoSwitch2/comments/1k9ee3g/i_was_only_able_to_get_a_mario_kart_bundle_but/,0,You will have zero issue selling the mario kart digital code..40 dollars is a reasonable price..I know if I had gotten the bundle I would have done the same since I prefer the physical version over digital,Lakerfanalways
"I was ""only"" able to get a Mario kart bundle, but still want the physical. Do you think anyone, or would you want to buy the code for 40$?",Jojeff13,https://www.reddit.com/r/NintendoSwitch2/comments/1k9ee3g/i_was_only_able_to_get_a_mario_kart_bundle_but/,0,"Yes, loads of people.

I’ll be selling my code online too - you’ll be able to get much more than $40 for it - just price it $5 less than what the official RRP is on your region.",EvilTaffyapple
I feel like this square logo doesn't belong in this wide red banner.,SilverPlate_,https://www.reddit.com/gallery/1k9dkhw,856,would you rather people talk about how they don't like the prices or donkey kong's redesign for the umpteenth time? let people talk about things damn,Minimum-Echidna-3486
When I am asked why I am getting the switch 2,jbdroid,https://www.reddit.com/gallery/1k9cm55,228,"Welcome to your life as a service, for the low price of $4 extra you can add a tip and buy someone coffee (i.e. grow the stock you invest in too)",TryAltruistic7830
The Switch 2 scalpers could still be violating eBay's TOS even though it's less than 40 days until release,JustSomeSmartGuy,https://www.reddit.com/gallery/1k9bok7,30,I’ve stopped reporting and now just “contacting seller” and spamming DROP THE PRICE.  I know it’s doing absolutely nothing but gotta find way kill time till launch,dar24601
The Switch 2 scalpers could still be violating eBay's TOS even though it's less than 40 days until release,JustSomeSmartGuy,https://www.reddit.com/gallery/1k9bok7,30,"Most are roughly £600 which would convert to roughly $800USD. A few are upwards of £1000, which is roughly $1300USD. The UK price for the console is £396 or £430 for the bundle and it's worth noting that us brits do not pay any tax on top of that.

Edit: One thing I should add is that, at least in the UK, it's now free to sell on eBay, so these scalpers could potentially make a £200 profit with each console sold.",JustSomeSmartGuy
"Preordered Switch 2, never had Switch",ravagecat,https://www.reddit.com/r/NintendoSwitch2/comments/1k98xwz/preordered_switch_2_never_had_switch/,17,"Don't worry about memory expansion unless you are planning on getting several third party Switch 2 games right now. You can think about that later but even Switch 2 games made by Nintendo don't have that large of a memory storage issue.

If what you want is Switch games, I would recommend buying used games and looking for sales. Deku Deals is a great place to look.

Mario Kart 8 Deluxe is always a classic for good reason, it has DLC that expands the game but at full price it's $85 for both the base and DLC.

Super Mario Odyssey, Super Mario 3D World, and Captain Toad Treasure Tracker have nice co op modes. The Mario + Rabbids games frequently go on sale and have solid gameplay, and I believe there is a multiplayer option for some gameplay in Kingdom Battle though I have only played it on single player.

If you're looking for variety that isn't Mario, I occasionally pick up and play Nintendo Switch Sports. If you've owned a Wii you're probably familiar with Wii Sports so you may enjoy something like that.

Also I would look into getting an NSO membership for the retro games because my nephews actually like playing those when they get the chance and some of them are multiplayer.

Most people will recommend the pro controller for best controller, but you should know that regular Switch controllers will work on a Switch 2 if you want to save because the older ones are cheaper. If you don't have an original Switch though you will need a charging dock for the regular Switch joycons.",PixieDustFairies
"Preordered Switch 2, never had Switch",ravagecat,https://www.reddit.com/r/NintendoSwitch2/comments/1k98xwz/preordered_switch_2_never_had_switch/,17,"Considering that the base storage is massively improved from a measly 32GB, in the original Switch, to a whopping 256GB, for now, I wouldn't rush to buy a micro SD EXPRESS card. 

Only Lexar has the 1Tb micro SD EXPRESS card on the market, but other manufacturers will come out with theirs later on, which will also bring down the price of cards over time.

For Switch games, 1Tb in general is really overkill for the average person. Most people will be more than fine with 256-512GB cards. 

Besides that, I don't have additional recommendations that haven't already been said at the moment",FluxionFluff
Who else is getting Cyberpunk 2077?,Rarewear_fan,https://www.reddit.com/r/NintendoSwitch2/comments/1k9abje/who_else_is_getting_cyberpunk_2077/,132,I will but will probably wait a few months and cop a deep sale I’ve already bought it on pc and ps5 no need to buy again at full price.,Bootychomper23
Who else is getting Cyberpunk 2077?,Rarewear_fan,https://www.reddit.com/r/NintendoSwitch2/comments/1k9abje/who_else_is_getting_cyberpunk_2077/,132,"Not for $70.. it’s half that price or lower everywhere else 75% of the time. 

If they drop it on sale maybe",omariousmaximus
remember when nintendo was THE value brand for families and average consumers?,Ok_Rain8345,https://i.redd.it/2b9zmdy41fxe1.png,0,"""families and average consumers are now out priced"" - not really",SugarBoy511
remember when nintendo was THE value brand for families and average consumers?,Ok_Rain8345,https://i.redd.it/2b9zmdy41fxe1.png,0,"Wii was able to be inexpensive relative to the competition because instead of using contemporary hardware it was basically a beefed up GameCube. It maxed out at 480p over analog video while the competition was already in the HD era with 1080p HDMI output and played HD movies, and Wii didn't play DVDs because they didn't want to pay for the license. Let's also not forget that the Wii Remote retailed for $40 and a Nunchuk for $20, which adjusted for inflation is equivalent to $95 Joy-Cons. The $50 games would have been equal to $80 today as well. The ""Nintendo Selects"" line was great but that wasn't introduced until 5 years after launch and only 2 years before the Wii U would release. Overall, it sold very well to the non-hardcore gamer crowd, who didn't care that they were getting last generation tech with a new gimmick, but they also lost a ton of 3rd party support that generation due to how difficult it was to port multiplatform games due to the graphical limitations and awkward control schemes, which also lost them a lot of those hardcore gamers, who only would buy a Wii as a secondary console after the Xbox 360 or PS3, if at all.

Wii U famously was a flop so I wouldn't look there for inspiration. The deluxe model got a $50 price cut replacing the base model a month after launch from its original price tag of $350 ($480 today), still couldn't save it. 3DS was universally considered to be overpriced for a handheld at $250 ($350 today), and had to cut the price by $80 just 4 months after launch, which did help salvage that console from what was sure to become a failure. The 2DS line is what made it affordable.",4playerstart
remember when nintendo was THE value brand for families and average consumers?,Ok_Rain8345,https://i.redd.it/2b9zmdy41fxe1.png,0,"And we've finally gotten to the phase where people say ""Remember how much we loved the Wii, Wii u, and 2DS. We always loved them. You're just misremembering when Nintendo was the laughing stock of the gaming industry."" They had good games in-spite of the system. That's what people loved about them. Motion controls, and the screen gamepad were things basically only used well by a few games made by nintendo themselves. for everyone else, those aspects were either ignored, or shoehorned into games where they didn't belong, making them worse. The 2DS wedge was similarly ridiculed, and only used by little kids who break things and shouldn't use 3D, people without the money for a 3DS, and people who want to trade Pokemon to themselves. (if I remember correctly, it launched the same day as Pokemon X and Y)

You can't have already forgotten the Switch Lite. And you can't actually believe that they aren't planning to release another one eventually. And you can't seriously think that they should loudly broadcast when they're going to lower the price on anything. If they say ""It's $450 now, but in two years we'll be lowering it to $400"" how many people would go ""oh, I guess I'll just wait two years then.""

I'll give you credit for the games. It's a bit weird that they don't ever drop the prices even after years, but it's not like they're very old and outdated. As an example, there's no reason to play Madden 23 when Madden 24 comes out (I don't know sports games) so there's no reason to keep selling 23 at the same price. But Nintendo games are famously evergreen to the point where they're by far the company that people emulate games from the most, and it's not even close.",Redpyrobyte
remember when nintendo was THE value brand for families and average consumers?,Ok_Rain8345,https://i.redd.it/2b9zmdy41fxe1.png,0,"Wii U was pretty expensive and they took a loss on it too despite it being priced so high. If you have some familiarity with specs and relative costs the Switch 2 is fantastic value imo. I would not be surprised if they were breaking even on the Switch 2. 


Think about the full package, 1080p, hdr, vrr, 120hz screen, two teched out joycons with HD rumble 2, gyro, accelerometer, and mouse modes, a cooling, charging, and output dock, then the console itself looks to be pretty capable. 


Custom Nvidia GPU with a very recent architecture capable of DLSS and Ray Tracing, a beefy CPU way closer to a PS5 than a PS4, and 12gbs ram, which is less than the standard 16gbs now but console optimization will make the difference there. 


Portable consoles/pcs are always more expensive than their home consoles/desktop counterparts. And at $450 for the power Switch 2 looks great imo as someone who also plays on PC.",Mountain-Papaya-492
remember when nintendo was THE value brand for families and average consumers?,Ok_Rain8345,https://i.redd.it/2b9zmdy41fxe1.png,0,"To get some perspective about some games costing $70 or $80 dollars in 2025 you might like to have a read of this, as an insight to the price of games in 1996, when the average salary was probably around half of what it is now:

[https://www.gamingbible.com/news/1996-ad-shows-ps1-n64-games-stupidly-expensive-647465-20230104](https://www.gamingbible.com/news/1996-ad-shows-ps1-n64-games-stupidly-expensive-647465-20230104)

From this article:

 “Alas and alack - at least it's not 1996 any more. This [advert ](https://www.reddit.com/r/gaming/comments/102j2jk/think_video_games_today_are_expensive_look_at_1996/)from a Toys R Us magazine shows games like [*Super Mario 64* ](https://www.gamingbible.co.uk/super-mario)for $59.99, [*Star Wars*](https://www.gamingbible.co.uk/star-wars)*: Shadows of the Empire* for $69.99 and [*DOOM* ](https://www.gamingbible.co.uk/doom)*64* for $74.99. On the other side of the spread, PS1 classics like [*Twisted Metal 2*](https://www.gamingbible.co.uk/news/twisted-metal-show-will-capture-ballsout-fun-20221128)sold for $39.99, [*Need for Speed*](https://www.gamingbible.co.uk/need-for-speed) *II* for $49.99, and the [*Die Hard Trilogy*](https://www.gamingbible.co.uk/features/games-die-hard-trilogy-a-brutal-ambitious-classic-20200207) for $54.99.”",Avalonian_Seeker444
remember when nintendo was THE value brand for families and average consumers?,Ok_Rain8345,https://i.redd.it/2b9zmdy41fxe1.png,0,"I'm sorry you had to spend that much, but this comment made me laugh my ass off. 

  
The main telling point of this whole price thing is this. Before in the 90s or early 2000, I never heard anyone complain about their backlog being too big. ever since like 2010 to now, I hear taht shit all the time",Right-Fortune-8644
remember when nintendo was THE value brand for families and average consumers?,Ok_Rain8345,https://i.redd.it/2b9zmdy41fxe1.png,0,"Wii U: $423  
Wii: $403  
Switch 1: $400  
Switch OLED: $428

Yeah, within $50 bucks is all in the same ballpark, especially after multiple rounds of tariffs (Trump and Biden increased tariffs). Probably just teens or chronically online younger adults whining lol. Maybe it's the first console they have to buy with their own money. I'm not a boomer, and I do hate when they say shit like ""stop eating out"" or ""don't get starbucks"", but this is literally a price difference of a couple caramel macchiato's 

And they sold out of all pre-orders and are on track to have the largest release day every (6-8 million) per Bloomberg, so, yeah the average person is not priced out.",kinganthony3
remember when nintendo was THE value brand for families and average consumers?,Ok_Rain8345,https://i.redd.it/2b9zmdy41fxe1.png,0,"i dont know the us prices but yeah, 64 games back then sure werent cheap.",Few-Strawberry4997
It’s going to be a long 39 days…,Accomplished-Tune152,https://www.reddit.com/r/NintendoSwitch2/comments/1k99u7e/its_going_to_be_a_long_39_days/,370,"I've so much backlog and stuff on wishlist elsewhere that I do not see it a problem at all.
In fact, I've preordered just for FOMO for the not too much overpriced bundle with MK.",gingegnere
It’s going to be a long 39 days…,Accomplished-Tune152,https://www.reddit.com/r/NintendoSwitch2/comments/1k99u7e/its_going_to_be_a_long_39_days/,370,"I really wanted to wait for a new color variant of some sort, but the FOMO hits hard. I’m also scared of price increases in the US.",Accomplished-Tune152
It’s going to be a long 39 days…,Accomplished-Tune152,https://www.reddit.com/r/NintendoSwitch2/comments/1k99u7e/its_going_to_be_a_long_39_days/,370,"I got a preorder too. Now instead of being excited for a preorder, I can be excited for the console. I really wanted to get one because I didn’t know what the price would be a few months from now.",Accomplished-Tune152
